{
  "schema_version": "paraflow.evidence-verification/v1",
  "status": "passed",
  "evidence_path": "results/day06/day06-scalar-profile-df96257.json",
  "evidence_sha256": "0123456789abcdef0123456789abcdef0123456789abcdef0123456789abcdef",
  "evidence_schema": "paraflow.scalar-profile-report/v1",
  "suite_name": "day06-scalar-profile-v1",
  "experiment_count": 4,
  "retained_sample_count": 190,
  "repository_identities_verified": 5,
  "engine_artifact_verified": false
}
